{
  "schemaVersion": "evaluation-model-input.v1",
  "fixtureId": "model-input:TS-TRJ-006:r1",
  "dataClass": "synthetic_shareable",
  "scenarioId": "TS-TRJ-006",
  "input": {
    "task": "Fetch one synthetic public page with the declared bounded retry policy.",
    "source": {
      "sourceRef": "source-syn-trj-006",
      "kind": "synthetic_public_url_input",
      "url": "https://example.invalid/timeout"
    },
    "scope": {
      "accountRef": "acct-syn-owner",
      "pursuitRef": "pursuit-syn-main",
      "purpose": "bounded_public_research"
    }
  }
}
