{
  "schemaVersion": "evaluation-model-input.v1",
  "fixtureId": "model-input:TS-ID-106:r1",
  "dataClass": "synthetic_shareable",
  "scenarioId": "TS-ID-106",
  "input": {
    "task": "Assess whether two authorized records warrant a human merge review.",
    "source": {
      "sourceRef": "source-syn-ts-id-106",
      "kind": "synthetic_identity_clues",
      "capturedAt": "2026-09-01T08:30:00Z",
      "clues": [
        {
          "clueRef": "clue-1",
          "kind": "shared_public_handle_hash",
          "value": "handle-hash-syn-106"
        },
        {
          "clueRef": "clue-2",
          "kind": "overlapping_context_token",
          "value": "context-syn-106"
        }
      ]
    },
    "scope": {
      "accountRef": "acct-syn-owner",
      "pursuitRef": "pursuit-syn-main",
      "purpose": "identity_review"
    }
  }
}
