{
  "schemaVersion": "evaluation-model-input.v1",
  "fixtureId": "model-input:TS-TRJ-002:r1",
  "dataClass": "synthetic_shareable",
  "scenarioId": "TS-TRJ-002",
  "input": {
    "task": "Read the explicit synthetic public URL and answer the single role-history question.",
    "source": {
      "sourceRef": "source-syn-trj-002",
      "kind": "synthetic_public_url_input",
      "url": "https://example.invalid/synthetic-role-history",
      "question": "What role token is shown on this page?"
    },
    "scope": {
      "accountRef": "acct-syn-owner",
      "pursuitRef": "pursuit-syn-main",
      "purpose": "bounded_public_research"
    }
  }
}
