{
  "schemaVersion": "evaluation-model-input.v1",
  "fixtureId": "model-input:TS-CAP-001:r1",
  "dataClass": "synthetic_shareable",
  "scenarioId": "TS-CAP-001",
  "input": {
    "task": "Extract reviewable observations from this intentional synthetic capture.",
    "source": {
      "sourceRef": "source-syn-cap-001",
      "kind": "synthetic_screenshot_description",
      "capturedAt": "2026-09-01T08:00:00Z",
      "language": [
        "en"
      ],
      "visibleContent": [
        {
          "spanRef": "span-1",
          "speaker": "candidate",
          "text": "I need to decide by Wednesday."
        },
        {
          "spanRef": "span-2",
          "speaker": "candidate",
          "text": "Tuesday afternoon is available."
        }
      ]
    },
    "scope": {
      "accountRef": "acct-syn-owner",
      "pursuitRef": "pursuit-syn-main",
      "purpose": "candidate_momentum_review"
    }
  }
}
