{
  "schemaVersion": "evaluation-model-input.v1",
  "fixtureId": "model-input:TS-ACT-105:r1",
  "dataClass": "synthetic_restricted",
  "scenarioId": "TS-ACT-105",
  "input": {
    "task": "Reconcile the synthetic approved Calendar operation after transport response loss.",
    "source": {
      "sourceRef": "approval-syn-act-105",
      "kind": "synthetic_exact_approval",
      "previewDigest": "preview-digest-syn-105",
      "idempotencyKey": "idem-syn-act-105"
    },
    "scope": {
      "accountRef": "acct-syn-owner",
      "pursuitRef": "pursuit-syn-main",
      "purpose": "governed_action_review"
    }
  }
}
