{
  "schemaVersion": "evaluation-model-input.v1",
  "fixtureId": "model-input:TS-CAP-005:r1",
  "dataClass": "synthetic_restricted",
  "scenarioId": "TS-CAP-005",
  "input": {
    "task": "Extract the forwarded statement with its speaker attribution.",
    "source": {
      "sourceRef": "source-syn-cap-005",
      "kind": "synthetic_screenshot_description",
      "capturedAt": "2026-09-01T08:20:00Z",
      "language": [
        "en"
      ],
      "visibleContent": [
        {
          "spanRef": "span-1",
          "speaker": "recruiter",
          "text": "Forwarded from the hiring manager: The role requires relocation."
        },
        {
          "spanRef": "span-2",
          "speaker": "candidate",
          "text": "Thanks for checking."
        }
      ]
    },
    "scope": {
      "accountRef": "acct-syn-owner",
      "pursuitRef": "pursuit-syn-main",
      "purpose": "candidate_momentum_review"
    }
  }
}
