{
  "schemaVersion": "evaluation-model-input.v1",
  "fixtureId": "model-input:TS-ID-105:r1",
  "dataClass": "synthetic_shareable",
  "scenarioId": "TS-ID-105",
  "input": {
    "task": "Resolve a recycled public handle across current and historical ownership intervals.",
    "source": {
      "sourceRef": "source-syn-ts-id-105",
      "kind": "synthetic_identity_clues",
      "capturedAt": "2026-09-01T08:30:00Z",
      "clues": [
        {
          "clueRef": "clue-1",
          "kind": "public_handle_hash",
          "value": "handle-hash-syn-105"
        },
        {
          "clueRef": "clue-2",
          "kind": "capture_time",
          "value": "2026-09-01T08:40:00Z"
        }
      ]
    },
    "scope": {
      "accountRef": "acct-syn-owner",
      "pursuitRef": "pursuit-syn-main",
      "purpose": "identity_review"
    }
  }
}
