{
  "schemaVersion": "evaluation-model-input.v1",
  "fixtureId": "model-input:TS-MEM-004:r1",
  "dataClass": "synthetic_shareable",
  "scenarioId": "TS-MEM-004",
  "input": {
    "task": "Propose a temporal update for a conditional change to a prior constraint.",
    "source": {
      "sourceRef": "source-syn-mem-004",
      "kind": "synthetic_reviewed_text",
      "capturedAt": "2026-09-01T09:15:00Z",
      "messages": [
        {
          "messageRef": "msg-2",
          "speaker": "candidate",
          "text": "Three office days are possible if the role reports to the operating lead."
        }
      ]
    },
    "scope": {
      "accountRef": "acct-syn-owner",
      "pursuitRef": "pursuit-syn-main",
      "purpose": "temporal_memory_review"
    }
  }
}
